{  "$schema": "http://json-schema.org/draft-04/schema#",
  "name": "Yearn Strategies",
  "logoURI": "https://",
  "keywords": ["audited", "verified", "special strategy" ,"endorsed"],
  "tags": {
    "description": {
      "name": "strategy description",
      "description": "[A-Z,1-9]"
    },
    "strategy": {
      "name": "[A-Z,1-9]",
      "description": "[A-Z,1-9]"
    }
  },
  "timestamp": "2020-06-12T00:00:00+00:00",
  "type": "object",
  "properties": {
    "apiVersion": {
      "type": "string"
    },
    "blockNumber": {
      "type": "string"
    },
    "deploymentId": {
      "type": "string"
    },
    "id": {
      "type": "string"
    },
    "status": {
      "type": "string"
    },
    "strategies": {
      "type": "array",
      "items": [
        {
          "type": "object",
          "properties": {
                  "status": { 
                      "type": "string" 
            },
            "blockNumber": {
              "type": "string"
            },
            "debtLimit": {
              "type": "string"
            },
            "id": {
              "type": "string"
            },
            "performanceFee": {
              "type": "string"
            },
            "rateLimit": {
              "type": "string"
            },
            "strategy": {
              "type": "string"
            },
            "timestamp": {
              "type": "string"
            },
            "vault": {
              "type": "string"
            }
          },
          "required": [
              "status",
            "blockNumber",
            "debtLimit",
            "id",
            "performanceFee",
            "rateLimit",
            "strategy",
            "timestamp",
            "vault"
          ]
        }
      ]
    },
    "timestamp": {
      "type": "string"
    },
    "token": {
      "type": "string"
    },
    "tokenDecimals": {
      "type": "string"
    },
    "tokenName": {
      "type": "string"
    },
    "tokenSymbol": {
      "type": "string"
    },
    "transaction": {
      "type": "object",
      "properties": {
        "id": {
          "type": "string"
        }
      },
      "required": [
        "id"
      ]
    },
    "vault": {
      "type": "string"
    },
    "vaultDecimals": {
      "type": "string"
    },
    "vaultName": {
      "type": "string"
    },
    "vaultSymbol": {
      "type": "string"
    }
  },
  "required": [
    "apiVersion",
    "blockNumber",
    "deploymentId",
    "id",
    "status",
    "strategies",
    "timestamp",
    "token",
    "tokenDecimals",
    "tokenName",
    "tokenSymbol",
    "transaction",
    "vault",
    "vaultDecimals",
    "vaultName",
    "vaultSymbol"
  ],
  
  "strategy": [
    {
      "chainId": 1,
      "deploymentId": "0x",
      "symbol": "[A-Z,1-9]",
      "name": "[A-Z,1-9]",
      "decimals": 6,
      "logoURI": "ipfs://",
      "tags": ["[A-Z,1-9]"]
    }
  ],
  "version": {
    "major": 0,
    "minor": 3,
    "patch": 0
  }
}